{
  "bank_id": "bank_20250829_001",
  "title": "Banco de Preguntas - Derecho Administrativo",
  "description": "Banco de preguntas sobre principios fundamentales del derecho administrativo y conceptos básicos de la administración pública",
  "questions": [
    {
      "id": "q_001",
      "question": "¿Cuál es el principio fundamental que rige la actuación de la Administración Pública?",
      "options": [
        "Principio de discrecionalidad absoluta",
        "Principio de legalidad y jerarquía normativa",
        "Principio de oportunidad política",
        "Principio de libre decisión administrativa"
      ],
      "correct_answer": 1,
      "explanation": "El principio de legalidad establece que la Administración debe someterse al ordenamiento jurídico y actuar con arreglo a Derecho, según el artículo 9.3 de la Constitución Española.",
      "source_info": {
        "document": "Manual_Derecho_Administrativo.pdf",
        "section": "Tema 1: Principios del Derecho Administrativo",
        "page": 15,
        "legal_reference": "Artículo 9.3 CE y Ley 40/2015"
      },
      "difficulty": "medium",
      "category": "derecho_administrativo",
      "keywords": ["legalidad", "principios", "administración pública", "constitución"],
      "estimated_time_seconds": 90
    },
    {
      "id": "q_002",
      "question": "¿En qué casos los familiares del empresario NO tienen consideración de trabajadores por cuenta ajena?",
      "options": [
        "Cuando trabajan menos de 20 horas semanales",
        "Cuando conviven en el hogar del empresario y están a su cargo",
        "Cuando tienen más de 65 años",
        "Cuando trabajan en fines de semana únicamente"
      ],
      "correct_answer": 1,
      "explanation": "Los familiares del empresario hasta el segundo grado que convivan en su hogar y estén a su cargo no tienen consideración de trabajadores por cuenta ajena, salvo prueba en contrario.",
      "source_info": {
        "document": "BOE-A-2015-11724-consolidado.pdf",
        "section": "Artículo 12. Familiares",
        "page": 11,
        "legal_reference": "Real Decreto Legislativo 8/2015, de 30 de octubre"
      },
      "difficulty": "medium",
      "category": "afiliacion",
      "keywords": ["familiares", "empresario", "cuenta ajena", "convivencia"],
      "estimated_time_seconds": 75
    },
    {
      "id": "q_003",
      "question": "¿Qué permite establecer en los regímenes de la Seguridad Social cuando resulte necesario?",
      "options": [
        "Sistemas especiales solo para cotización",
        "Sistemas especiales en encuadramiento, afiliación, cotización o recaudación",
        "Excepciones permanentes a la afiliación",
        "Regímenes temporales de 6 meses"
      ],
      "correct_answer": 1,
      "explanation": "En los regímenes de la Seguridad Social pueden establecerse sistemas especiales exclusivamente en encuadramiento, afiliación, forma de cotización o recaudación cuando resulte necesario.",
      "source_info": {
        "document": "BOE-A-2015-11724-consolidado.pdf",
        "section": "Disposiciones sobre sistemas especiales",
        "page": 10,
        "legal_reference": "Real Decreto Legislativo 8/2015, de 30 de octubre"
      },
      "difficulty": "hard",
      "category": "afiliacion",
      "keywords": ["sistemas especiales", "regímenes", "encuadramiento", "cotización"],
      "estimated_time_seconds": 120
    },
    {
      "id": "q_004",
      "question": "¿Qué información debe figurar en el Fichero General de Afiliación para el cálculo de bases de cotización?",
      "options": [
        "Solo los días trabajados",
        "Los días trabajados y de alta facilitados por las empresas",
        "Únicamente las horas trabajadas",
        "Solo la categoría profesional"
      ],
      "correct_answer": 1,
      "explanation": "La Tesorería General de la Seguridad Social toma los días trabajados y de alta que figuren en el Fichero General de Afiliación, según la información facilitada por las empresas.",
      "source_info": {
        "document": "BOE-A-2025-3780-consolidado-cotizaciones.pdf",
        "section": "Bases de cotización normalizadas",
        "page": 20,
        "legal_reference": "Orden PJC/178/2025, de 25 de febrero"
      },
      "difficulty": "medium",
      "category": "cotizacion",
      "keywords": ["fichero general", "afiliación", "bases cotización", "días trabajados"],
      "estimated_time_seconds": 90
    },
    {
      "id": "q_005",
      "question": "¿Qué tipo de resoluciones pueden adoptarse de forma automatizada en los procedimientos de Seguridad Social?",
      "options": [
        "Solo las relacionadas con pensiones",
        "Exclusivamente las de desempleo",
        "Las de gestión de protección por desempleo y prestaciones del sistema, excepto pensiones no contributivas",
        "Únicamente las de afiliación"
      ],
      "correct_answer": 2,
      "explanation": "Pueden adoptarse resoluciones automatizadas en procedimientos de protección por desempleo y prestaciones del sistema de Seguridad Social, excluyendo las pensiones no contributivas, así como en afiliación, cotización y recaudación.",
      "source_info": {
        "document": "BOE-A-2021-21007-consolidado-IMV.pdf",
        "section": "Artículo 130. Tramitación electrónica",
        "page": 55,
        "legal_reference": "Ley 19/2021, de 20 de diciembre"
      },
      "difficulty": "hard",
      "category": "procedimientos",
      "keywords": ["resoluciones automatizadas", "tramitación electrónica", "desempleo", "prestaciones"],
      "estimated_time_seconds": 105
    }
  ]
}